{
  "id": "FJ-012",
  "title": "Phase 1: engine sequences, invocation counts, and expectations",
  "phase": "phase-1",
  "objective": "Implement zero-based response-sequence consumption, invocation counting at selection time, sequence-exhausted outcomes, and expect evaluation.",
  "status": "review",
  "baseRevision": "f866a06",
  "candidateRevision": "4c18396",
  "assignedRole": "specifier",
  "attempts": 1,
  "specReferences": [
    "§40.6 invocation count",
    "§40.7 response sequences",
    "§12.7 invocation expectations",
    "§44.7 golden vector"
  ],
  "relevantFiles": [
    "spec/fake-jev-technical-spec-v2.md",
    "docs/development/acceptance-catalog.md"
  ],
  "allowedFiles": [
    "internal/engine/sequence.go",
    "internal/engine/stub.go",
    "internal/engine/engine.go",
    "internal/engine/matcher.go",
    "internal/engine/sequence_test.go"
  ],
  "acceptance": [
    "C-SEQ-001",
    "C-SEQ-002",
    "C-SEQ-003",
    "C-SEQ-004",
    "C-SEQ-005",
    "C-SEQ-007",
    "C-SEQ-008"
  ],
  "nonGoals": [
    "no named scenario DSL",
    "no implicit repeat-last",
    "no reset endpoint (that is FJ-021)"
  ],
  "verificationCommands": [],
  "lastVerification": null,
  "blockers": [],
  "leaseOwner": null,
  "stage": "qa",
  "nextAction": "refresh scope evidence for matcher integration, then cleaner, hardener, and QA",
  "notes": [],
  "statusHistory": ["planned", "ready", "implementing", "verifying", "review"]
}
