{
  "id": "FJ-017",
  "title": "Phase 1: HTTP host dispatch, limits, and failure mapping",
  "phase": "phase-1",
  "objective": "Serve the data plane over HTTP with per-plane body limits, journal capacity enforcement, unknown-route handling, and the exact §43 fake-failure bodies.",
  "status": "complete",
  "baseRevision": "49263a2",
  "candidateRevision": "25d0634",
  "assignedRole": "specifier",
  "attempts": 1,
  "specReferences": [
    "§7 high-level system design",
    "§17.4 concurrency",
    "§19.4 resource limits",
    "§43 normative fake-server HTTP failures"
  ],
  "relevantFiles": [
    "spec/fake-jev-technical-spec-v2.md",
    "docs/development/acceptance-catalog.md"
  ],
  "allowedFiles": [
    "internal/host/http/server.go",
    "internal/host/http/router.go",
    "internal/host/http/server_test.go"
  ],
  "acceptance": [
    "C-HOST-004",
    "C-HOST-006",
    "C-HOST-007",
    "C-HOST-008",
    "C-MATCH-010",
    "C-GOLD-014",
    "C-GOLD-015"
  ],
  "nonGoals": [
    "no control API (FJ-020)",
    "no signals or ready file (FJ-031)",
    "no journal bookkeeping (FJ-013)"
  ],
  "verificationCommands": [],
  "lastVerification": {
    "candidateFingerprint": "35e197abcaf1232556d96fbea5a9fc08ead097834fc3063daa85935685723864",
    "finishedAt": "2026-09-29T09:13:59Z",
    "report": ".agent/reports/FJ-017/report-20260929T091359Z.json",
    "result": "passed",
    "revision": "6dbbbae",
    "summary": "49 passed, 0 failed, 3 skipped, 0 not_applicable",
    "taskFingerprint": "e56486e8ee7c2c403e987715b5cd6c1cb6aff7bce6387ecbd053b7a256bea81e"
  },
  "blockers": [],
  "leaseOwner": null,
  "stage": "qa",
  "nextAction": "run fresh specifier, then coder, cleaner, hardener, and QA stages",
  "notes": [],
  "statusHistory": ["planned", "ready", "implementing", "verifying", "review", "complete"]
}
