{
  "id": "FJ-031",
  "title": "Phase 3: serve command, ready file, signals, and logging",
  "phase": "phase-3",
  "objective": "Implement `fake-jev serve` with flag precedence, loopback default bind, ephemeral port support, atomic ready file, graceful shutdown on SIGINT/SIGTERM, and stderr logging with Authorization redaction.",
  "status": "implementing",
  "baseRevision": "6094965",
  "candidateRevision": null,
  "assignedRole": "specifier",
  "attempts": 1,
  "specReferences": [
    "\u00a715.1 serve",
    "\u00a742.3 signals",
    "\u00a742.4 ready file",
    "\u00a742.5 logging destinations",
    "\u00a720 observability and diagnostics"
  ],
  "relevantFiles": [
    "spec/fake-jev-technical-spec-v2.md",
    "docs/development/acceptance-catalog.md"
  ],
  "allowedFiles": [
    "internal/cli/dispatch.go",
    "internal/cli/serve.go",
    "internal/cli/serve_test.go",
    "internal/host/http/server.go"
  ],
  "acceptance": [
    "C-CLI-004",
    "C-CLI-006",
    "C-CLI-007",
    "C-CLI-010",
    "C-ARCH-006",
    "C-CFG-011"
  ],
  "nonGoals": [
    "no run orchestration",
    "no log-format json beyond the flag contract",
    "no control-plane authentication"
  ],
  "verificationCommands": [],
  "lastVerification": null,
  "blockers": [],
  "nextAction": "run fresh specifier, then coder, cleaner, hardener, and QA stages",
  "notes": [
    "scope amendment 2026-09-29 (PM): added internal/cli/dispatch.go so the serve command is routable, matching the FJ-030 precedent. internal/host/http/server.go is already allowed, so the /__fake/ control-plane delegation is in scope here."
  ],
  "statusHistory": [
    "planned",
    "ready",
    "implementing"
  ],
  "stage": "specifier",
  "leaseOwner": "pm-fj031-pickup"
}
